{
  "$schema": "https://json-schema.org/draft/2020-12/schema",
  "$id": "https://appliance-release/schemas/installed-state.v1.schema.json",
  "title": "InstalledState",
  "description": "Atomic on-host journal record of the exact installed state, written after every lifecycle transaction. Backs status, verify, upgrade compatibility checks, and K3s ownership decisions.",
  "type": "object",
  "additionalProperties": false,
  "required": [
    "schemaVersion",
    "applianceInstanceId",
    "installedVersion",
    "installedReleaseId",
    "components",
    "k3sOwnership",
    "lastOperation",
    "createdAt",
    "updatedAt"
  ],
  "properties": {
    "schemaVersion": {
      "const": 1
    },
    "applianceInstanceId": {
      "type": "string",
      "minLength": 1,
      "description": "Stable identifier for this host installation, generated on first install."
    },
    "installedVersion": {
      "type": "string",
      "pattern": "^[0-9]+\\.[0-9]+\\.[0-9]+(-[0-9A-Za-z.-]+)?$"
    },
    "installedReleaseId": {
      "type": "string",
      "minLength": 1
    },
    "applianceProfile": {
      "type": "string",
      "pattern": "^[a-z][a-z0-9-]*$",
      "description": "Product-facing appliance profile selected from the signed metadata catalog for this installation."
    },
    "applianceName": {
      "type": "string",
      "pattern": "^[a-z0-9]([a-z0-9-]{0,61}[a-z0-9])?$",
      "description": "Product LAN instance label; FQDN is applianceName.dnsZone."
    },
    "dnsZone": {
      "type": "string",
      "minLength": 3,
      "description": "LAN DNS zone for this appliance identity (default appliance.internal)."
    },
    "cluster": {
      "type": "object",
      "description": "Cluster-scoped appliance identity and explicit enrolled-node inventory. Optional so existing single-node receipts remain readable.",
      "additionalProperties": false,
      "required": ["id", "topology", "controlPlaneNode", "ingressNode", "nodes"],
      "properties": {
        "id": {"type": "string", "minLength": 1},
        "topology": {"enum": ["single-server", "server-workers", "multi-server"]},
        "controlPlaneNode": {"type": "string", "minLength": 1},
        "ingressNode": {"type": "string", "minLength": 1},
        "controlEndpoint": {"type": "string", "pattern": "^https://.+"},
        "controlEndpoints": {
          "type": "array",
          "items": {"type": "string", "pattern": "^https://.+"},
          "uniqueItems": true
        },
        "clusterCAHash": {"type": "string", "pattern": "^sha256:[a-f0-9]{64}$"},
        "enrollmentSignerFingerprint": {"type": "string", "pattern": "^sha256:[a-f0-9]{64}$"},
        "clusterCIDR": {"type": "string", "minLength": 1},
        "serviceCIDR": {"type": "string", "minLength": 1},
        "nodes": {
          "type": "array",
          "minItems": 1,
          "items": {
            "type": "object",
            "additionalProperties": false,
            "required": ["id", "name", "role"],
            "properties": {
              "id": {"type": "string", "minLength": 1},
              "nodeUID": {"type": "string", "minLength": 1},
              "name": {"type": "string", "minLength": 1},
              "role": {"enum": ["control-plane", "worker", "inference"]},
              "roles": {"type": "array", "items": {"enum": ["control-plane", "worker", "inference"]}, "uniqueItems": true}
            }
          }
        }
      }
    },
    "components": {
      "type": "object",
      "additionalProperties": false,
      "required": [
        "k3sVersion",
        "chartVersion"
      ],
      "properties": {
        "k3sVersion": {
          "type": "string",
          "minLength": 1
        },
        "chartVersion": {
          "type": "string",
          "minLength": 1
        },
        "databaseEngine": {
          "enum": ["postgres"],
          "description": "Authoritative control-plane database engine. Omitted only for receipts created before database-engine tracking."
        },
        "artifactServerVersion": {
          "type": "string",
          "minLength": 1,
          "description": "Installed artifact server version when the artifact capability is enabled."
        },
        "dnsVersion": {
          "type": "string",
          "minLength": 1,
          "description": "Installed CoreDNS version when the dns capability is enabled."
        },
        "inferenceVersion": {
          "type": "string",
          "minLength": 1,
          "description": "Installed inference runtime version when the inference capability is enabled."
        },
        "videoVersion": {
          "type": "string",
          "minLength": 1,
          "description": "Installed video runtime version when the video capability is enabled."
        },
        "metadataVersion": {
          "type": "string",
          "minLength": 1,
          "description": "Installed base appliance metadata-bundle version (X.Y.Z.N)."
        },
        "metadataDigest": {
          "type": "string",
          "pattern": "^sha256:[a-f0-9]{64}$",
          "description": "Digest of the staged appliance metadata-bundle archive."
        }
      }
    },
    "k3sOwnership": {
      "type": "object",
      "additionalProperties": false,
      "required": [
        "owned",
        "ownerApplianceVersion"
      ],
      "properties": {
        "owned": {
          "const": true
        },
        "ownerApplianceVersion": {
          "type": "string",
          "minLength": 1
        }
      }
    },
    "lastOperation": {
      "$ref": "#/$defs/operation"
    },
    "history": {
      "type": "array",
      "items": {
        "$ref": "#/$defs/operation"
      }
    },
    "createdAt": {
      "type": "string",
      "format": "date-time"
    },
    "updatedAt": {
      "type": "string",
      "format": "date-time"
    },
    "runtimes": {
      "type": "object",
      "additionalProperties": {
        "type": "object",
        "additionalProperties": false,
        "required": [
          "package",
          "inferenceEngine",
          "architecture"
        ],
        "properties": {
          "package": {
            "type": "string",
            "pattern": "^[a-z][a-z0-9-]*$"
          },
          "inferenceEngine": {
            "type": "string",
            "pattern": "^[a-z][a-z0-9-]*$"
          },
          "architecture": {
            "type": "string",
            "pattern": "^[a-z][a-z0-9-]*$"
          }
        }
      }
    }
  },
  "$defs": {
    "operation": {
      "type": "object",
      "additionalProperties": false,
      "required": [
        "type",
        "status",
        "transactionId",
        "startedAt"
      ],
      "properties": {
        "type": {
          "enum": [
            "install",
            "upgrade",
            "repair",
            "backup",
            "restore",
            "uninstall",
            "factory-reset"
            ,"cluster-enrollment-create"
            ,"cluster-join"
            ,"cluster-node-register"
            ,"cluster-inference-deploy"
            ,"cluster-node-remove"
            ,"cluster-worker-upgrade"
          ]
        },
        "status": {
          "enum": [
            "in-progress",
            "completed",
            "failed",
            "rolled-back"
          ]
        },
        "transactionId": {
          "type": "string",
          "minLength": 1
        },
        "startedAt": {
          "type": "string",
          "format": "date-time"
        },
        "completedAt": {
          "type": "string",
          "format": "date-time"
        },
        "sourceVersion": {
          "type": "string",
          "description": "Set for upgrade operations: the version upgraded from."
        },
        "targetVersion": {
          "type": "string",
          "description": "Set for upgrade operations: the version upgraded to."
        }
      },
      "allOf": [
        {
          "if": {
            "properties": {
              "status": {
                "const": "completed"
              }
            },
            "required": [
              "status"
            ]
          },
          "then": {
            "required": [
              "completedAt"
            ]
          }
        }
      ]
    }
  }
}
