{
  "schemaVersion": 1,
  "applianceInstanceId": "9f4d6b1e-2a3c-4e5f-8b1a-7c6d5e4f3a2b",
  "installedVersion": "2.4.0",
  "installedReleaseId": "01J8QK3F9G7XA6P0V6ZC9N6R4T",
  "components": {
    "k3sVersion": "v1.30.4+k3s1",
    "chartVersion": "2.4.0"
  },
  "k3sOwnership": {
    "owned": true,
    "ownerApplianceVersion": "2.4.0"
  },
  "lastOperation": {
    "type": "upgrade",
    "status": "in-progress",
    "transactionId": "txn-01J8QK9H1M2NC8R2X8AE1Q8T6V",
    "startedAt": "2026-07-03T09:00:00Z",
    "sourceVersion": "2.4.0",
    "targetVersion": "2.5.0"
  },
  "history": [
    {
      "type": "install",
      "status": "completed",
      "transactionId": "txn-01J8QK4G8H9YB7Q1W7ZD0P7S5U",
      "startedAt": "2026-06-02T04:00:00Z",
      "completedAt": "2026-06-02T04:12:31Z"
    }
  ],
  "createdAt": "2026-06-02T04:00:00Z",
  "updatedAt": "2026-06-02T04:12:31Z"
}
